{
  "$schema": "./tianyan-paths.schema.json",
  "formatVersion": 1,
  "contentRevision": 4,
  "passives": [
    {
      "id": "tianyan.passive.yan_root",
      "name": "衍法",
      "description": "五行法术触发相生或相克时，伤害提高5%。",
      "modifiers": [
        {
          "damageBonus": "0.05*(hasStatus.tianyan.status.mark.water+hasStatus.tianyan.status.mark.earth)",
          "when": {
            "skillIds": [
              "tianyan.skill.wood"
            ],
            "damageOrigins": [
              "action-direct"
            ]
          }
        },
        {
          "damageBonus": "0.05*(hasStatus.tianyan.status.mark.wood+hasStatus.tianyan.status.mark.metal)",
          "when": {
            "skillIds": [
              "tianyan.skill.fire"
            ],
            "damageOrigins": [
              "action-direct"
            ]
          }
        },
        {
          "damageBonus": "0.05*(hasStatus.tianyan.status.mark.fire+hasStatus.tianyan.status.mark.water)",
          "when": {
            "skillIds": [
              "tianyan.skill.earth"
            ],
            "damageOrigins": [
              "action-direct"
            ]
          }
        },
        {
          "damageBonus": "0.05*(hasStatus.tianyan.status.mark.earth+hasStatus.tianyan.status.mark.wood)",
          "when": {
            "skillIds": [
              "tianyan.skill.metal"
            ],
            "damageOrigins": [
              "action-direct"
            ]
          }
        },
        {
          "damageBonus": "0.05*(hasStatus.tianyan.status.mark.metal+hasStatus.tianyan.status.mark.fire)",
          "when": {
            "skillIds": [
              "tianyan.skill.water"
            ],
            "damageOrigins": [
              "action-direct"
            ]
          }
        }
      ]
    },
    {
      "id": "tianyan.passive.heng_root",
      "name": "执衡",
      "description": "森罗缚、山河倾覆、天锋一线的法力消耗降低10%。"
    },
    {
      "id": "tianyan.passive.scarlet",
      "name": "朱焰",
      "description": "焚天流火伤害提高8%，法力消耗提高10%。",
      "modifiers": [
        {
          "damageBonus": 0.08,
          "when": {
            "skillIds": [
              "tianyan.skill.fire"
            ],
            "damageOrigins": [
              "action-direct"
            ]
          }
        }
      ]
    },
    {
      "id": "tianyan.passive.stream",
      "name": "涓流",
      "description": "沧海横流法力消耗降低20%，伤害降低5%。",
      "modifiers": [
        {
          "damageBonus": -0.05,
          "when": {
            "skillIds": [
              "tianyan.skill.water"
            ],
            "damageOrigins": [
              "action-direct"
            ]
          }
        }
      ]
    },
    {
      "id": "tianyan.passive.edge",
      "name": "锋芒",
      "description": "天锋一线伤害提高10%，额外破盾由50%降至25%。",
      "modifiers": [
        {
          "damageBonus": 0.1,
          "when": {
            "skillIds": [
              "tianyan.skill.metal"
            ],
            "damageOrigins": [
              "action-direct"
            ]
          }
        }
      ]
    },
    {
      "id": "tianyan.passive.ember",
      "name": "余火",
      "description": "燎原不再增加基础攻击人数，改为对次要目标附加2次余火伤害。"
    },
    {
      "id": "tianyan.passive.split",
      "name": "分锋",
      "description": "淬锋额外攻击一个目标，主要目标伤害降低15%。",
      "modifiers": [
        {
          "damageBonus": -0.15,
          "when": {
            "skillIds": [
              "tianyan.skill.metal"
            ],
            "damageOrigins": [
              "action-direct"
            ],
            "requireStatusIds": [
              "tianyan.status.mark.earth"
            ],
            "targetSlot": "primary"
          }
        }
      ]
    },
    {
      "id": "tianyan.passive.rain",
      "name": "润物",
      "description": "凝露、滋荣作用于两名气血比例最低的友方，每人恢复降低30%。"
    },
    {
      "id": "tianyan.passive.borrow",
      "name": "借势",
      "description": "领悟借势：单体法术攻击并获得护盾，将法印推进至相生的下一行。55法力，冷却5回合。"
    },
    {
      "id": "tianyan.passive.plain",
      "name": "守拙",
      "description": "玄元守一减伤提高至30%，持续降至1回合，冷却降至4回合。"
    },
    {
      "id": "tianyan.passive.clear",
      "name": "澄明",
      "description": "澄灵诀额外移除一个符合条件的减益，法力消耗提高50%，冷却提高至3回合。"
    },
    {
      "id": "tianyan.passive.wild",
      "name": "燎野",
      "description": "燎原额外增加一个攻击目标，该次火法伤害降低8%。",
      "modifiers": [
        {
          "damageBonus": -0.08,
          "when": {
            "skillIds": [
              "tianyan.skill.fire"
            ],
            "damageOrigins": [
              "action-direct"
            ],
            "requireStatusIds": [
              "tianyan.status.mark.wood"
            ]
          }
        }
      ]
    },
    {
      "id": "tianyan.passive.dew",
      "name": "温泽",
      "description": "凝露治疗提高35%，触发凝露的水法伤害降低8%。",
      "modifiers": [
        {
          "damageBonus": -0.08,
          "when": {
            "skillIds": [
              "tianyan.skill.water"
            ],
            "damageOrigins": [
              "action-direct"
            ],
            "requireStatusIds": [
              "tianyan.status.mark.metal"
            ]
          }
        }
      ]
    },
    {
      "id": "tianyan.passive.spring",
      "name": "长春",
      "description": "滋荣多恢复一次，每次恢复降低20%；触发滋荣的木法伤害降低8%。",
      "modifiers": [
        {
          "damageBonus": -0.08,
          "when": {
            "skillIds": [
              "tianyan.skill.wood"
            ],
            "damageOrigins": [
              "action-direct"
            ],
            "requireStatusIds": [
              "tianyan.status.mark.water"
            ]
          }
        }
      ]
    },
    {
      "id": "tianyan.passive.solitary",
      "name": "独照",
      "description": "场上存活敌人不足三人时，每少一人，焚天流火、沧海横流伤害提高6%。",
      "modifiers": [
        {
          "damageBonus": "max(0,3-enemyCount)*0.06",
          "when": {
            "skillIds": [
              "tianyan.skill.fire",
              "tianyan.skill.water"
            ],
            "damageOrigins": [
              "action-direct"
            ]
          }
        }
      ]
    },
    {
      "id": "tianyan.passive.reflection",
      "name": "映霞",
      "description": "自身气血低于40%时，物理、法术承伤降低8%；五行法术伤害降低4%。",
      "modifiers": [
        {
          "damageTakenBonus": -0.08,
          "when": {
            "sourceHpRatioBelow": 0.4,
            "requireKind": "physical"
          }
        },
        {
          "damageTakenBonus": -0.08,
          "when": {
            "sourceHpRatioBelow": 0.4,
            "requireKind": "spell"
          }
        },
        {
          "damageBonus": -0.04,
          "when": {
            "skillIds": [
              "tianyan.skill.wood",
              "tianyan.skill.fire",
              "tianyan.skill.earth",
              "tianyan.skill.metal",
              "tianyan.skill.water"
            ],
            "damageOrigins": [
              "action-direct"
            ]
          }
        }
      ]
    },
    {
      "id": "tianyan.passive.springwater",
      "name": "清泉",
      "description": "澄灵诀附加少量治疗，法力消耗提高20%。"
    },
    {
      "id": "tianyan.passive.return",
      "name": "归流",
      "description": "触发生克的五行法术法力消耗降低25%，伤害降低8%。",
      "modifiers": [
        {
          "damageBonus": "-0.08*(hasStatus.tianyan.status.mark.water+hasStatus.tianyan.status.mark.earth)",
          "when": {
            "skillIds": [
              "tianyan.skill.wood"
            ],
            "damageOrigins": [
              "action-direct"
            ]
          }
        },
        {
          "damageBonus": "-0.08*(hasStatus.tianyan.status.mark.wood+hasStatus.tianyan.status.mark.metal)",
          "when": {
            "skillIds": [
              "tianyan.skill.fire"
            ],
            "damageOrigins": [
              "action-direct"
            ]
          }
        },
        {
          "damageBonus": "-0.08*(hasStatus.tianyan.status.mark.fire+hasStatus.tianyan.status.mark.water)",
          "when": {
            "skillIds": [
              "tianyan.skill.earth"
            ],
            "damageOrigins": [
              "action-direct"
            ]
          }
        },
        {
          "damageBonus": "-0.08*(hasStatus.tianyan.status.mark.earth+hasStatus.tianyan.status.mark.wood)",
          "when": {
            "skillIds": [
              "tianyan.skill.metal"
            ],
            "damageOrigins": [
              "action-direct"
            ]
          }
        },
        {
          "damageBonus": "-0.08*(hasStatus.tianyan.status.mark.metal+hasStatus.tianyan.status.mark.fire)",
          "when": {
            "skillIds": [
              "tianyan.skill.water"
            ],
            "damageOrigins": [
              "action-direct"
            ]
          }
        }
      ]
    },
    {
      "id": "tianyan.passive.breath",
      "name": "生息",
      "description": "五行法术触发相生时，自身恢复10法力，每次施法一次。"
    },
    {
      "id": "tianyan.passive.adapt",
      "name": "御变",
      "description": "五行法术触发相克时，自身法防提高10%，持续2回合；该次伤害降低4%。",
      "modifiers": [
        {
          "damageBonus": -0.04,
          "when": {
            "skillIds": [
              "tianyan.skill.wood"
            ],
            "damageOrigins": [
              "action-direct"
            ],
            "requireStatusIds": [
              "tianyan.status.mark.earth"
            ]
          }
        },
        {
          "damageBonus": -0.04,
          "when": {
            "skillIds": [
              "tianyan.skill.fire"
            ],
            "damageOrigins": [
              "action-direct"
            ],
            "requireStatusIds": [
              "tianyan.status.mark.metal"
            ]
          }
        },
        {
          "damageBonus": -0.04,
          "when": {
            "skillIds": [
              "tianyan.skill.earth"
            ],
            "damageOrigins": [
              "action-direct"
            ],
            "requireStatusIds": [